SI IN IVS VOCAT, ITO. NI IT, ANTESTAMINO. IGITVR EM CAPITO. SI CALVITVR PEDEMVE STRVIT, MANVM ENDO IACITO. SI MORBVS AEVITASVE VITIVM ESCIT, IVMENTVM DATO. SI NOLET, ARCERAM NE STERNITO. ASSIDVO VINDEX ASSIDVVS ESTO. PROLETARIO IAM CIVI QVIS VOLET VINDEX ESTO. ... VADES ... SVBVADES ... NEX ... FORTI SANATI ... REM VBI PACVNT, ORATO. NI PACVNT, IN COMITIO AVT IN FORO ANTE MERIDIEM CAVSSAM COICIVNTO. COM PERORANTO AMBO PRAESENTES. POST MERIDIEM PRAESENTI LITEM ADDICITO. SI AMBO PRAESENTES, SOLIS OCCASVS SVPREMA TEMPESTAS ESTO.;
Transcription;Traduction;
si in ius vocat, ito. ni it, antestamino. igitur em capito.[a 11],[a 12];Si l'on cite quelqu'un en justice, qu'il y aille. S'il n'y va pas, que l'on appelle des témoins. Seulement ensuite, qu'on le capture.;
si calvitur pedemve struit, manum endo iacito.[a 13];S'il esquive ou fuit, qu'on le capture.;
si morbus aevitasve vitium escit, iumentum dato. si nolet, arceram ne sternito.[a 14];S'il y a maladie ou vieillesse, qu'on lui fournisse une bête de somme. S'il n'en veut pas, qu'on ne le couvre pas.;
assiduo vindex assiduus esto. proletario iam civi quis volet vindex esto.[a 15];Qu'à un propriétaire foncier soit garant un autre propriétaire foncier. Qu'à un prolétaire soit garant n'importe quel citoyen qui le veut bien.;
... vades ... subvades ...[a 15];... ceux qui se portent caution d'un emprunt par engagement oral ... les cautions en second ...;
nex ... forti sanati ... — nexo solutoque, forti sanatique idem jus esto.[a 16];Que ceux qui sont engagés (par nexum ou mancipium) et ceux qui sont dégagés aient le même droit.;
rem ubi pacunt, orato.[a 17];S'ils s'accordent, qu'on le proclame.;
ni pacunt, in comitio aut in foro ante meridiem caussam coiciunto. com peroranto ambo praesentes.[a 17];S'ils ne s'accordent pas, qu'ils exposent leur cas au forum avant midi. Que tous deux soient présents pendant les exposés.;
post meridiem praesenti litem addicito.[a 17],[a 18],[a 19];Après midi, qu'on adjuge l'objet du litige à celui qui est présent.;
si ambo praesentes, solis occasus suprema tempestas esto.[a 17],[a 18],[a 19];Si tous les deux sont présents, que le crépuscule mette fin au litige.;
... MORBVS SONTICVS ... AVT STATVS DIES CVM HOSTE ... QVID HORVM FVIT VNVM IVDICI ARBITROVE REOVE, EO DIES DIFFISSVS ESTO. CVI TESTIMONIVM DEFVERIT, IS TERTIIS DIEBVS OB PORTVM OBVAGVLATVM ITO. ... DE REBVS M AERIS PLVRISVE D ASSIBVS, DE MINORIS VERO L ASSIBVS SACRAMENTO CONTENDEBATVR. AT SI DE LIBERTATE HOMINIS CONTROVERSIA ERAT, TAMEN VT L ASSIBVS SACRAMENTO CONTENDERETVR. ... ... PER IVDICIS POSTVLATIONEM AGEBATVR ...;
Transcription;Traduction;
... morbus sonticus ... aut status dies cum hoste ... quid horum fuit unum iudici arbitrove reove, eo dies diffissus esto.[a 20],[a 21];... une grave maladie ... ou un jour fixé avec un ennemi ; ... si l'un ou l'autre de ces empêchements est un obstacle pour le juge, l'arbitre ou l'accusé, que le jour soit différé.;
cui testimonium defuerit, is tertiis diebus ob portum obvagulatum ito.[a 22];Que celui à qui le témoignage a manqué aille interpeller à haute voix son adversaire trois jours devant sa porte.;
de rebus M aeris plurisve D assibus, de minoris vero L assibus sacramento contendebatur.[a 23];On se défie pour 500 as pour les affaires d'une valeur minimale de 1 000 as, et de 50 as pour les affaires de valeur moindre.;
at si de libertate hominis controversia erat, tamen ut L assibus sacramento contenderetur.[a 23];S'il y a controverse sur la liberté d'un individu, l'enjeu est limité à 50 as.;
... per iudicis postulationem agebatur ...[a 24];... l'action en pétition de juge ...;
AERIS CONFESSI REBVSQVE IVRE IVDICATIS XXX DIES IVSTI SVNTO. POST DEINDE MANVS INIECTIO ESTO. IN IVS DVCITO. NI IVDICATVM FACIT AVT QVIS ENDO EO IN IVRE VINDICIT, SECVM DVCITO, VINCITO AVT NERVO AVT COMPEDIBVS XV PONDO, NE MAIORE AVT SI VOLET MINORE VINCITO. SI VOLET SVO VIVITO, NI SVO VIVIT, QVI EVM VINCTVM HABEBIT, LIBRAS FARIS ENDO DIES DATO. SI VOLET, PLVS DATO. ERAT AVTEM IVS INTEREA PACISCENDI AC, SI PACTI FORENT, HABEBANTVR IN VINCVLIS DIES SEXAGINTA. INTER EOS DIES TRINIS NVNDINIS CONTINVIS AD PRAETOREM IN COMITIVM PRODVCEBANTVR, QVANTAEQVE PECVNIAE IVDICATI ESSENT, PRAEDICABATVR. TERTIIS AVTEM NVNDINIS CAPITE POENAS DABANT, AVT TRANS TIBERIM PEREGRE VENVM IBANT. TERTIIS NVNDINIS PARTIS SECANTO. SI PLVS MINVSVE SECVERVNT, SE FRAVDE ESTO. ADVERSVS HOSTEM AETERNA AVCTORITAS <ESTO>.;
Transcription;Traduction;
aeris confessi rebusque iure iudicatis XXX dies iusti sunto.[a 25];Une fois la dette reconnue ou l'affaire jugée en procès légitime, que le débiteur ait 30 jours pour payer.;
post deinde manus iniectio esto. in ius ducito.[a 25];Ensuite, qu'il y ait finalement mainmise sur lui. Qu'on le conduise devant le juge.;
ni iudicatum facit aut quis endo eo in iure vindicit, secum ducito, vincito aut nervo aut compedibus XV pondo, ne maiore aut si volet minore vincito.[a 25];S'il ne satisfait pas au jugement ou si personne ne se porte garant pour lui en justice, qu'il l'emmène avec lui, le lie avec une corde ou avec des chaînes d'un poids maximum de 15 livres, moins s'il le veut.;
si volet suo vivito, ni suo vivit, qui eum vinctum habebit, libras faris endo dies dato. si volet, plus dato.[a 25];S'il le veut, qu'il vive à ses propres frais. S'il ne vit pas à ses propres frais, que celui qui l'enchaîne lui donne une livre de farine par jour. S'il le veut, qu'il donne plus.;
erat autem ius interea paciscendi ac, si pacti forent, habebantur in vinculis dies sexaginta.[a 26];À défaut d'arrangement, le débiteur est enchaîné soixante jours.;
inter eos dies trinis nundinis continuis ad praetorem in comitium producebantur, quantaeque pecuniae iudicati essent, praedicabatur.[a 26];Durant cet intervalle, pendant trois jours de marchés consécutifs, qu'on le conduise au comice et qu'on lui rappelle chaque fois à haute voix le montant de sa condamnation.;
tertiis autem nundinis capite poenas dabant, aut trans Tiberim peregre venum ibant.[a 26];Au troisième jour du marché, il est puni de la peine capitale, ou d'être vendu à l'étranger au-delà du Tibre.;
tertiis nundinis partis secanto. si plus minusve secuerunt, se fraude esto.[a 27];Au troisième jour du marché, qu'on le coupe <le débiteur> en morceaux. S'ils <les créanciers> en prennent plus qu'il en leur est dû, que cela se fasse en toute impunité.;
adversus hostem aeterna auctoritas <esto>.[a 20];Contre un ennemi, le droit de propriété est toujours valide.;
CITO NECATVS INSIGNIS AD DEFORMITATEM PVER ESTO. SI PATER FILIVM TER VENVM DVIT, FILIVS A PATRE LIBER ESTO. ILLAM SVAM SVAS RES SIBI HABERE IVSSIT CLAVES ADEMIT, EXEGIT. CONCEPISSET IN DECEM MENSIBVS GIGNI HOMINEM.;
Transcription;Traduction;
cito necatus insignis ad deformitatem puer esto.[a 28];Que soit tué l'enfant atteint d'une difformité manifeste.;
si pater filium ter venum duit, filius a patre liber esto.[a 29],[a 30];Si le père vend <loue> trois fois son fils, que le fils soit libéré de son père[n 4].;
illam suam suas res sibi habere iussit claves ademit, exegit.[a 31];Qu'il ordonne à sa femme d'emmener ses frusques <en cas de divorce>, et qu'elle rende les clefs.;
concepisset in decem mensibus gigni hominem.[a 32];L'enfantement doit avoir lieu dans les dix mois.;
FEMINAS, ETIAMSI PERFECTAE AETATIS SINT, IN TVTELA ESSE ... EXCEPTIS VIRGINIBVS VESTALIBVS. MVLIERIS, QVAE IN AGNATORVM TVTELA ERAT, RES MANCIPII VSVCAPI NON POTERANT, PRAETERQVAM SI AB IPSA TVTORE <AVCTORE> TRADITAE ESSENT. VTI LEGASSIT SVPER PECVNIA TVTELAVE SVAE REI, ITA IVS ESTO. SI INTESTATO MORITVR, CVI SVVS HERES NEC ESCIT, ADGNATVS PROXIMVS FAMILIAM HABETO. SI ADGNATVS NEC ESCIT, GENTILES FAMILIAM HABENTO. QVIBVS TESTAMENTO ... TVTOR DATVS NON SIT, AGNATI SVNT TVTORES. SI FVRIOSVS ESCIT, ADGNATVM GENTILIVMQVE IN EO PECVNIAQVE EIVS POTESTAS ESTO. ... AST EI CVSTOS NEC ESCIT ... PRODIGO INTERDICITVR BONORVM SVORVM ADMINISTRATIO. PRODIGVM, CVI BONIS INTERDICTVM EST, IN CVRATIONE IVBET ESSE AGNATORVM. CIVIS ROMANI LIBERTI HEREDITATEM PATRONO DEFERT, SI INTESTATO SINE SVO HEREDE LIBERTVS DECESSERIT. EA, QVAE IN NOMINIBVS SVNT, ... IPSO IVRE IN PORTIONES HEREDITARIAS DIVISA SVNT. AES ALIENVM HEREDITARIVM PRO PORTIONIBVS QVAESITIS SINGVLIS IPSO IVRE DIVISVM. HAEC ACTIO (FAMILIAE HERCISCVNDAE) PROFICISCITVR.;
Transcription;Traduction;
feminas, etiamsi perfectae aetatis sint, in tutela esse ... exceptis virginibus Vestalibus.[a 33];Les femmes, même majeures, restent en tutelle ... à l'exception des vierges Vestales.;
mulieris, quae in agnatorum tutela erat, res mancipii usucapi non poterant, praeterquam si ab ipsa tutore <auctore> traditae essent.[a 34];Les biens de la femme qui est en tutelle des agnats ne peuvent être usucapés comme biens mancipables, excepté s'ils ont été livrés par elle avec l'autorisation du tuteur.;
uti legassit super pecunia tutelave suae rei, ita ius esto.[a 35];Ce que l'on aura ordonné par testament, quant à son argent, ou pour la conservation de son bien, doit être exactement exécuté.;
si intestato moritur, cui suus heres nec escit, adgnatus proximus familiam habeto.[a 36];Si une personne meurt sans testament et sans héritiers, l'agnat le plus proche hérite.;
si adgnatus nec escit, gentiles familiam habento.[a 37];S'il n'y a pas d'agnats, que les membres de la gens héritent.;
quibus testamento ... tutor datus non sit, agnati sunt tutores.[a 38];Si le testament ne désigne pas de tuteur, les agnats deviennent tuteurs.;
si furiosus escit, adgnatum gentiliumque in eo pecuniaque eius potestas esto.;Si quelqu'un est fou furieux et qu'il n'a pas de gardien, son agnat le plus proche a l'autorité sur lui et son patrimoine.;
... ast ei custos nec escit ...[a 39];... mais il n'y aura pas de gardien pour lui ...;
prodigo interdicitur bonorum suorum administratio.[a 40];On interdit au prodigue l'administration de ses biens.;
prodigum, cui bonis interdictum est, in curatione iubet esse agnatorum.[a 41];Le prodigue ou le fou, auquel on a ôté l'administration de ses biens, est sous la curatelle de ses agnats.;
civis Romani liberti hereditatem patrono defert, si intestato sine suo herede libertus decesserit.[a 42];Qu'on défère au patron la succession de l'affranchi, citoyen romain, mort sans testament et sans héritiers.;
ea, quae in nominibus sunt, ... ipso iure in portiones hereditarias divisa sunt.[a 43];Les dettes passives et actives du défunt ne sont point divisibles, car elles sont de plein droit divisées en portions héréditaires.;
aes alienum hereditarium pro portionibus quaesitis singulis ipso iure divisum.[a 44];Les dettes de la succession sont divisées proportionnellement par un pacte entre les héritiers du débiteur.;
haec actio (familiae herciscundae) proficiscitur.[a 45];Cette action permet (à des cohéritiers) de cesser d'être en commun <pour la succession>.;
CVM NEXVM FACIET MANCIPIVMQVE, VTI LINGVA NVNCVPASSIT, ITA IVS ESTO. SATIS ESSET EA PRAESTARI, QVAE ESSENT LINGVA NVNCVPATA, QVAE QVI INFITIATVS ESSET, DVPLI POENAM SVBIRET, A IVRIS CONSVLTIS ETIAM RETICENTIAE POENA EST CONSTITVTA. VSVS AVCTORITAS FVNDI BIENNIVM EST, ... CETERARVM RERVM OMNIVM ... ANNVVS EST VSVS. TIGNVM IVNCTVM AEDIBVS VINEAVE SEI CONCAPIT NE SOLVITO.;
Transcription;Traduction;
cum nexum faciet mancipiumque, uti lingua nuncupassit, ita ius esto.[a 46];Lorsqu'on fait nexum (prise de possession) ou mancipium (cession), et qu'on le déclare oralement, le droit est donné.;
satis esset ea praestari, quae essent lingua nuncupata, quae qui infitiatus esset, dupli poenam subiret, a iuris consultis etiam reticentiae poena est constituta.[a 47];Il suffit de fournir ce qui a été formellement déclaré, et celui qui a trompé est condamné à la peine du double.;
usus auctoritas fundi biennium est, ... ceterarum rerum omnium ... annuus est usus.[a 48];<L'usucapion> des biens mobiliers se fait par an, celui des maisons par deux ans.;
tignum iunctum aedibus vineave sei concapit ne solvito.[a 49];Nul ne doit détacher les poutres des bâtiments ou des vignes d'autrui.;
VIAE LATITVDO IN PORRECTVM OCTO PEDES HABET, IN ANFRACTVM, ID EST VBI FLEXVM EST, SEDECIM. AMSEGETES VIAS MVNIVNTO : DONICVM LAPIDES SVNT: NI MVNIERINT, QVA VOLENT JVMENTA AGITO. SI AQVA PLVVIA NOCET ... IVBETVR EX ARBITRIO COERCERI. SI PER PVBLICVM LOCVM RIVVS AQVAE DVCTVS PRIVATO NOCEBIT, ERIT ACTIO PRIVATO, VT NOXA DOMINO SARCIATVR. VT XV PEDES ALTIVS RAMI ARBORIS CIRCVMCIDANTVR. SI ARBOR EX VICINI FVNDO VENTO INCLINATA IN TVVM FVNDVM IST, DE ADIMENDA EA RECTE AGERE POTES. VT GLANDEM IN ALIENVM FVNDVM PROCIDENTEM LICERET COLLIGERE.;
Transcription;Traduction;
viae latitudo in porrectum octo pedes habet, in anfractum, id est ubi flexum est, sedecim.[a 50];La largeur du chemin doit être de huit pieds en ligne droite et seize dans les virages.;
amsegetes vias muniunto : donicum lapides sunt: ni munierint, qua volent jumenta agito.[a 51];Que les chemins privés soient bordés de pierres <par leur propriétaire>. Sinon, par défaut, <les autres> peuvent faire passer les animaux où ils veulent.;
si aqua pluvia nocet ... iubetur ex arbitrio coerceri.[a 52];Si l'eau pluviale <d'une autre propriété> cause des dommages <à un propriétaire> ... <le propriétaire> peut en appeler à un juge.;
si per publicum locum rivus aquae ductus privato nocebit, erit actio privato, ut noxa domino sarciatur.[a 53];Si un ruisseau passant à travers un lieu public forme un aqueduc et nuit à un particulier, celui-ci dispose d'une action visant à garantir la réparation du tort ainsi causé.;
ut XV pedes altius rami arboris circumcidantur.[a 54];Que les arbres soient élagués jusqu'à 15 pieds.;
si arbor ex vicini fundo vento inclinata in tuum fundum ist, de adimenda ea recte agere potes.[a 55];Si un arbre frappé d'un coup de vent penche de la propriété voisine sur la vôtre, vous avez une action pour le faire abattre.;
ut glandem in alienum fundum procidentem liceret colligere.[a 56];On peut ramasser le gland tombé sur la propriété d'autrui.;
QVI MALVNT CARMEN INCANTASSIT ... ... RES CAPITE ... SI QVIS OCCENTAVISSET SIVE CARMEN CONDIDISSET, QVOD INFAMIAM FACERET FLAGITIVMVE ALTERI. SI MEMBRVM RVPSIT, NI CVM EO PACIT, TALIO ESTO. MANV FVSTIVE SI OS FREGIT LIBERO, CCC, SI SERVO, CL POENAM SVBITO SI INIVRIAM FAXSIT, VIGINTI QVINQVE POENAE SVNTO.;
Transcription;Traduction;
qui malum carmen incantassit ...[a 57];Celui qui prononcera un maléfice ...;
... res capite ... si quis occentavisset sive carmen condidisset, quod infamiam faceret flagitiumve alteri.[a 58];... peine capitale ... pour celui qui a soit récité publiquement, soit composé des vers, qui attireraient sur autrui le déshonneur ou l'infamie.;
si membrum rupsit, ni cum eo pacit, talio esto.[a 59],[a 60];Si on a estropié un autre et qu'on n'a pas conclu d'accord à l'amiable avec la victime, que la peine du Talion soit appliquée.;
manu fustive si os fregit libero, CCC, si servo, CL poenam subito si iniuriam faxsit, viginti quinque poenae sunto.[a 61];Si quelqu'un casse les os d'un autre à la main ou grâce à une massue, que la peine soit de 300 sesterces, si c'est un esclave, 150, s'il a fait un simple mal, vingt-cinq.;
NE INROGANTO ... NE FERVNTO;
HOMINEM MORTVVM IN VRBE NE SEPELITO NEVE URITO. QVI CORONAM PARIT IPSE PECVNIAVE EIVS HONORIS VIRTVTISVE ERGO ARDVITVR EI ... NEVE AVRVM ADDITO. AT CVI AVRO DENTES IVNCTI ESCVNT. AST IN CVM ILLO SEPELIET VRETVE, SE FRAVDE ESTO.;
Transcription;Traduction;
Hominem mortuum in Urbe ne sepelito neve urito.;L'homme mort, qu'on ne l'ensevelisse ni ne le brûle dans la ville.;
Qui coronam parit ipse pecuniave eius honoris virtutisve ergo arduitur ei ...;La couronne obtenue par la bravoure soit, sans qu'il y ait délit, placée sur le corps de celui qui l'a gagnée;
Neve aurum addito. At cui auro dentes iuncti escunt. Ast in cum illo sepeliet uretue, se fraude esto.;N'apporte pas d'or ... celui qui a les dents reliées par de l'or, si avec cet or on l'enterre ou le brûle, que ce soit sans délit.;
CONVBIA PLEBI CVM PATRIBVS SANXERVNT.;
Transcription;Traduction;
conubia plebi cum patribus sanxerunt.[a 62];Le mariage entre un plébéien et un patricien est prohibé.;
ADVERSVS EVM, QVI HOSTIAM EMISSET NEC PRETIVM REDDERET ; ITEM ADVERSVS EVM, QVI MERCEDEM NON REDDERET PRO EO IVMENTO, QVOD QVIS IDEO LOCASSET, VT INDE PECVNIAM ACCEPTAM IN DAPEM, ID EST IN SACRIFICIVM, IMPENDERET. SI SERVO FVRTVM FAXIT NOXIAMVE NOXIT. SI VINDICIAM FALSAM TVLIT, SI VELIT IS ... TOR ARBITROS TRIS DATO, EORVM ARBITRIO ... FRVCTVS DVPLIONE DAMNVM DECIDITO.;
Transcription;Traduction;
adversus eum, qui hostiam emisset nec pretium redderet ; item adversus eum, qui mercedem non redderet pro eo iumento, quod quis ideo locasset, ut inde pecuniam acceptam in dapem, id est in sacrificium, impenderet.[a 63];Contre celui qui aurait acheté un animal sans en acquitter le prix ; contre celui qui ne paierait pas la somme afférente à la bête donnée en location, à cette condition que l'argent retiré fût employé à une offrande.;
si servo furtum faxit noxiamve noxit.[a 64];Si un esclave se rend coupable de vol ou commet un délit ... l'action est préjudiciable.;
si vindiciam falsam tulit, si velit is ... tor arbitros tris dato, eorum arbitrio ... fructus duplione damnum decidito.[a 65];Si quelqu'un revendique faussement un bien ... trois juges sont nommés ... la sanction du dommage est le double de la valeur du bien.;
